{
  "releaseLevel": "2-public-alpha",
  "status": "experimental",
  "commit": "95634c7a875f050070fc8f7be42891d105182f53",
  "tag": "v0.1.0-alpha.1",
  "testFiles": 122,
  "tests": 453,
  "typecheckErrors": 0,
  "criticalInternalBlockers": 0,
  "externalReplication": "not-yet-established",
  "independentAudit": "not-yet-established",
  "certification": false,
  "productionSafetyGuarantee": false,
  "repository": "Semant-iq/Semantiq",
  "branch": "main",
  "semanticVersion": "0.1.0-alpha.1",
  "nodeVersion": "v22.15.0",
  "pnpmVersion": "11.7.0",
  "operatingSystem": "win32",
  "buildEnvironment": "local_clean_room",
  "timestamp": "2026-08-07T12:50:00Z"
}
